{
  "fresh_post_reveal_context": true,
  "interpretation_id": "agent-graph-review-envelope-v2-pattern-skeptical",
  "nonclaims_acknowledged": [
    "not principal-human review or a source-first human target",
    "not provider execution or an exact standalone provider envelope",
    "not a provider or model comparison",
    "not a statistically powered variance estimate",
    "not deterministic replay or expected model behavior",
    "not graph causation relevance correctness value or usefulness evidence",
    "not proof that either condition or answer is better",
    "not completion of F2 or F3",
    "not permission to expand traversal",
    "not a live skill runtime graph planner compiler or interface change"
  ],
  "pair_assessments": [
    {
      "burden_harm_or_lost_value_observation": "shape fixture only",
      "case_id": "replication-pair-01",
      "cited_frozen_move_ids": [],
      "frozen_material_decision_difference": "uncertain",
      "recurrence_observation": "shape fixture only",
      "sealed_pair_role": "within_condition",
      "uncertainty": "shape fixture only"
    },
    {
      "burden_harm_or_lost_value_observation": "shape fixture only",
      "case_id": "replication-pair-02",
      "cited_frozen_move_ids": [],
      "frozen_material_decision_difference": "uncertain",
      "recurrence_observation": "shape fixture only",
      "sealed_pair_role": "within_condition",
      "uncertainty": "shape fixture only"
    },
    {
      "burden_harm_or_lost_value_observation": "shape fixture only",
      "case_id": "replication-pair-03",
      "cited_frozen_move_ids": [],
      "frozen_material_decision_difference": "uncertain",
      "recurrence_observation": "shape fixture only",
      "sealed_pair_role": "within_condition",
      "uncertainty": "shape fixture only"
    },
    {
      "burden_harm_or_lost_value_observation": "shape fixture only",
      "case_id": "replication-pair-04",
      "cited_frozen_move_ids": [],
      "frozen_material_decision_difference": "uncertain",
      "recurrence_observation": "shape fixture only",
      "sealed_pair_role": "within_condition",
      "uncertainty": "shape fixture only"
    },
    {
      "burden_harm_or_lost_value_observation": "shape fixture only",
      "case_id": "replication-pair-05",
      "cited_frozen_move_ids": [],
      "frozen_material_decision_difference": "uncertain",
      "recurrence_observation": "shape fixture only",
      "sealed_pair_role": "cross_condition",
      "uncertainty": "shape fixture only"
    },
    {
      "burden_harm_or_lost_value_observation": "shape fixture only",
      "case_id": "replication-pair-06",
      "cited_frozen_move_ids": [],
      "frozen_material_decision_difference": "uncertain",
      "recurrence_observation": "shape fixture only",
      "sealed_pair_role": "cross_condition",
      "uncertainty": "shape fixture only"
    },
    {
      "burden_harm_or_lost_value_observation": "shape fixture only",
      "case_id": "replication-pair-07",
      "cited_frozen_move_ids": [],
      "frozen_material_decision_difference": "uncertain",
      "recurrence_observation": "shape fixture only",
      "sealed_pair_role": "cross_condition",
      "uncertainty": "shape fixture only"
    },
    {
      "burden_harm_or_lost_value_observation": "shape fixture only",
      "case_id": "replication-pair-08",
      "cited_frozen_move_ids": [],
      "frozen_material_decision_difference": "uncertain",
      "recurrence_observation": "shape fixture only",
      "sealed_pair_role": "cross_condition",
      "uncertainty": "shape fixture only"
    }
  ],
  "rationale": "Shape fixture only; no semantic interpretation.",
  "saw_sibling_review_or_interpretation": false,
  "schema_version": "lolla.product_delta_graph_replication_post_reveal_interpretation.v2",
  "source_review_id": "agent-graph-review-envelope-v2-skeptical",
  "state": "review_specific_pattern_mixed_or_uncertain"
}
